{
  "clip_id": "pexels-18187166-dune",
  "media": {
    "fps_denominator": 1001,
    "fps_numerator": 60000,
    "frame_count": 718,
    "height": 2160,
    "width": 3840
  },
  "model_runs": [
    {
      "code_revision": "ed4e38a",
      "command": [
        "python",
        "scripts/generate_dense_tracks.py",
        "--dataset-root",
        "datasets/recovered-clean-videos-v1",
        "--source-dir",
        "<verified-originals>",
        "--weights",
        "<sha256-pinned-yolo26x-seg.pt>",
        "--reid-weights",
        "<sha256-pinned-yolo26n-cls.pt>",
        "--config",
        "scripts/configs/yolo26x-dense-tracking.json",
        "--output-dir",
        "<new-ignored-output-directory>",
        "--generator-revision",
        "ed4e38a",
        "--device",
        "mps",
        "--apply"
      ],
      "config_file": "artifacts/yolo26x-dense-tracking.json",
      "config_sha256": "f1ce6cb8c59d51affa5bcdaf9c1ee564f66afa2a3e759e7a4567c670d41fe778",
      "license": {
        "spdx": "AGPL-3.0-only",
        "url": "https://github.com/ultralytics/ultralytics/blob/v8.4.120/LICENSE"
      },
      "model_name": "Ultralytics YOLO26x-seg COCO with Ultralytics YOLO26n-cls ImageNet ReID",
      "model_version": "YOLO26x-seg / ultralytics 8.4.120 + YOLO26n-cls / ultralytics 8.4.120",
      "raw_output_sha256": "2e18d86045a2ed28550e85e019a7e3f1daadabc9e4a8720a102b989b02182d2a",
      "run_id": "yolo26x-seg-tracktrack-pexels-18187166-dune",
      "weights_sha256": "92b3de0065766a17180d6219858717dc9d03cdce8a3ca9576c97fd75aabb64f3",
      "weights_uri": "https://github.com/ultralytics/assets/releases/download/v8.4.0/yolo26x-seg.pt"
    }
  ],
  "schema_version": "cvbench.source/v1",
  "source": {
    "license": {
      "file": "licenses/Pexels-License.txt",
      "name": "Pexels License",
      "spdx": "LicenseRef-Pexels",
      "url": "https://www.pexels.com/license/"
    },
    "sha256": "05bc3794c11d787e946d868f6d5e2d1a40b0939dc6218aa3263b138adc64e0cc",
    "title": "Florian Delee - pexels-18187166-dune",
    "uri": "https://www.pexels.com/video/a-man-walking-up-a-sand-dune-in-the-desert-18187166/"
  },
  "transformations": [
    {
      "config_file": "artifacts/yolo26x-dense-tracking.json",
      "config_sha256": "f1ce6cb8c59d51affa5bcdaf9c1ee564f66afa2a3e759e7a4567c670d41fe778",
      "description": "Processed every native source frame for person and dog instances; media bytes are unchanged.",
      "kind": "dense_model_annotation",
      "tool": "scripts/generate_dense_tracks.py at ed4e38a"
    }
  ]
}
